<?xml version="1.0" encoding="iso8859-1" ?>

<!DOCTYPE usecase SYSTEM '../txdata.dtd' >



  <usecase n='uc004' type='standard' lang='en' actor="">

  <title>Mark and list Items
  </title>

  <summary>Make a list of items for further processing (e.g., mark
    the items and retrieve them together) 
  </summary>
    <actor></actor>
    <situation></situation>
    <precondition></precondition>
    <postcondition></postcondition>
    <error>
    </error>
    <sequence>
    </sequence>
  <note></note>
  <related></related>

  </usecase>

