<?xml version="1.0" encoding="iso8859-1" ?>

<!DOCTYPE glossary SYSTEM '../txdata.dtd' >


<glossary buchstabe="I">


  <GlossEntry>
    <GlossTerm>Imprint</GlossTerm>
    <GlossSee>Publication Statement</GlossSee>
  </GlossEntry>


  <GlossEntry>
    <GlossTerm>International Standard for Bibliographical
      Description</GlossTerm>
    <Acronym>ISBD</Acronym>
    <GlossDef>
      


      
    </GlossDef>
    <GlossSeeAlso>AACR2R, PI, RAK</GlossSeeAlso>
  </GlossEntry>


</glossary>


