<?xml version="1.0" encoding="iso8859-1" ?>

<!DOCTYPE usecase SYSTEM '../txdata.dtd' >



  <usecase n='uc017' type='standard' lang='en' >

    <title>Organise folders and Databases
    </title>

    <summary>The Pybliographer database is logically organised as a
    folder hierarchy; external databases are listed seperately. Those
    lists and the associated entries may need user attention.
    </summary>
    <actor></actor>
    <situation></situation>
    <precondition></precondition>
    <postcondition></postcondition>
    <error>
    </error>
    <sequence>
    </sequence>
    <note></note>
    <related></related>

  </usecase>

