<?xml version="1.0" encoding="iso8859-1" ?>

<!DOCTYPE usecase SYSTEM '../txdata.dtd' >



  <usecase n='uc024' type='standard' lang='en' >

    <title>Search and replace records
    </title>

    <summary>Perform a (regexp) search-and-replace action on a result
    set.

    It is important that the replacing can be suitably limited. 
    </summary>
    <actor></actor>
    <situation></situation>
    <precondition></precondition>
    <postcondition></postcondition>
    <error>
    </error>
    <sequence>
    </sequence>
    <note></note>
    <related></related>

  </usecase>

