<?xml version="1.0" encoding="iso8859-1" ?>

<!DOCTYPE glossary SYSTEM '../txdata.dtd' >


<glossary buchstabe="E">

  <GlossEntry>
    <GlossTerm>      Expression
    </GlossTerm>
    <GlossDef>
      An equivalence class of <GlossTerm>manifestations</GlossTerm>,
      which share certain characteristic dependencies.

      Examples are translations of a work, that are traditonally
      equipped with an <GlossTerm>uniform title</GlossTerm> composed
      of the uniform title of the original work and a language
      indication: Shakespeare, William: Othello &lt;ger.&gt;

      Other common cases are pieces of music which can be expressed as
      scores or recorded performances, etc.
    </GlossDef>
    <GlossSeeAlso>Work</GlossSeeAlso>
    <GlossSeeAlso>Manifestation</GlossSeeAlso>
    <GlossSeeAlso>Heading</GlossSeeAlso>
  </GlossEntry>

 


</glossary>
